{
  "$schema": "http://json-schema.org/draft-07/schema#",
  "title": "Events",
  "type": "array",
  "items": {
    "type": "object",
    "required": ["id", "title", "date"],
    "properties": {
      "id": { "type": "string" },
      "title": { "type": "string" },
      "date": { "type": "string", "format": "date-time" },
      "location": { "type": "string" },
      "description": { "type": "string" },
      "url": { "type": "string" },
      "image": { "type": "string" }
    }
  }
}